{
  "taskId": "770e8400-e29b-41d4-a716-446655440002",
  "traceId": "9c9e6679-7425-40de-944b-e07fc1f90ae9",
  "messageType": "PROFILE_ANALYZE_TASK",
  "schemaVersion": "1.0.0",
  "retryCount": 0,
  "createdAt": "2026-07-16T10:40:00Z",
  "resumeProfileId": "profile_001",
  "roleDirection": "JAVA_BACKEND",
  "profileVersion": 1,
  "vectorizeCompleted": true
}
